"geocode.value","lon","lat","geoAddress"
"Durango, CO, United States",-107.8800667,37.27528,"durango, co, usa"
"Telluride, CO, United States",-107.8122852,37.9374939,"telluride, co 81435, usa"
"Deming, NM, United States",-107.7586404,32.2686981,"deming, nm 88030, usa"
"Rawlins, WY, United States",-107.2386627,41.7910697,"rawlins, wy 82301, usa"
"Carbondale, CO, United States",-107.2111628,39.4022054,"carbondale, co 81623, usa"
"Pagosa Springs, CO, United States",-107.0097617,37.26945,"pagosa springs, co 81147, usa"
"Crested Butte, CO, United States",-106.9878231,38.8697146,"crested butte, co 81224, usa"
"Sheridan, WY, United States",-106.9561791,44.7971939,"sheridan, wy 82801, usa"
"Radium Springs, NM, United States",-106.9106762,32.4928349,"radium springs, nm 88007, usa"
"Aspen, CO, United States",-106.8175387,39.1910983,"aspen, co 81611, usa"
"Mesilla, NM, United States",-106.8008376,32.2700945,"mesilla, nm, usa"
"Las Cruces, NM, United States",-106.7636538,32.3199396,"las cruces, nm, usa"
"Mesquite, NM, United States",-106.6966649,32.1645415,"mesquite, nm, usa"
"Rio Rancho, NM, United States",-106.6630437,35.2327544,"rio rancho, nm, usa"
"Albuquerque, NM, United States",-106.650422,35.0843859,"albuquerque, nm, usa"
"Albuquerquee, NM, United States",-106.650422,35.0843859,"albuquerque, nm, usa"
"Bernalillo, NM, United States",-106.5511369,35.30004,"bernalillo, nm, usa"
"El Paso, TX, United States",-106.4850217,31.7618778,"el paso, tx, usa"
"Ciudad Juarez, Mexico, United States",-106.4245478,31.6903638,"ciudad juárez, chihuahua, mexico"
"Cuidad Juarez, Mexico, TX, United States",-106.4245478,31.6903638,"ciudad juárez, chihuahua, mexico"
"Tijeras, NM, United States",-106.3878905,35.0795244,"tijeras, nm 87059, usa"
"Vail, CO, United States",-106.3780801,39.6433243,"vail, co 81657, usa"
"Near Vail/Breckinridge, CO, United States",-106.3780801,39.6433243,"vail, co 81657, usa"
"Cedar Crest, NM, United States",-106.3728019,35.1075459,"cedar crest, nm, usa"
", , Canada",-106.346771,56.130366,"canada"
"Abiquiu, NM, United States",-106.3186397,36.207241,"abiquiu, nm 87510, usa"
"Aiquiu, NM, United States",-106.3186397,36.207241,"abiquiu, nm 87510, usa"
"Casper, WY, United States",-106.2980824,42.848709,"casper, wy, usa"
"Mountainair, NM, United States",-106.241127,34.5203411,"mountainair, nm 87036, usa"
"Fabens, TX, United States",-106.1585867,31.50234,"fabens, tx, usa"
"Saguache, CO, United States",-106.1419671,38.0875,"saguache, co 81149, usa"
"Espanola, NM, United States",-106.0818233,35.9910383,"española, nm, usa"
"Española, NM, United States",-106.0818233,35.9910383,"española, nm, usa"
"Mariarty, NM, United States",-106.0491893,34.9900503,"moriarty, nm 87035, usa"
"Ojo Caliente, NM, United States",-106.0452736,36.3021225,"ojo caliente, nm, usa"
"Dillon, CO, United States",-106.0433518,39.6302643,"dillon, co, usa"
"Beckenridge, CO, United States",-106.0383518,39.4816537,"breckenridge, co 80424, usa"
"Breckenridge, CO, United States",-106.0383518,39.4816537,"breckenridge, co 80424, usa"
"Alamogordo, NM, United States",-105.960265,32.8995325,"alamogordo, nm 88310, usa"
"Alamagordo, NM, United States",-105.960265,32.8995325,"alamogordo, nm 88310, usa"
"Chimayo, NM, United States",-105.9469656,36.0039131,"chimayo, nm, usa"
"Galisteo, NM, United States",-105.9464093,35.3955945,"galisteo, nm 87540, usa"
"Santa Fe, NM, United States",-105.937799,35.6869752,"santa fe, nm, usa"
"Alamosa, CO, United States",-105.8700214,37.4694491,"alamosa, co 81101, usa"
"East Alamosa, CO, United States",-105.8700214,37.4694491,"alamosa, co 81101, usa"
"Statewide, CO, United States",-105.7820674,39.5500507,"colorado, usa"
"Crestone, CO, United States",-105.6997332,37.9963881,"crestone, co 81143, usa"
"Ruidoso, NM, United States",-105.6588485,33.3672525,"ruidoso, nm, usa"
"San Cristobal, NM, United States",-105.6394538,36.596413,"san cristobal, nm 87529, usa"
"Questa, NM, United States",-105.5950065,36.7039143,"questa, nm 87556, usa"
"Laramie, WY, United States",-105.5911007,41.3113669,"laramie, wy, usa"
"El Prado, NM, United States",-105.5746857,36.4317932,"el prado, nm 87529, usa"
"Taos, NM, United States",-105.5733788,36.4072134,"taos, nm 87571, usa"
"Guffey, CO, United States",-105.521369,38.7510722,"guffey, co 80820, usa"
"Idaho Springs, CO, United States",-105.5136081,39.7424881,"idaho springs, co, usa"
"Gillette, WY, United States",-105.5022205,44.2910915,"gillette, wy, usa"
"Bailey, CO, United States",-105.4786412,39.4060536,"bailey, co 80421, usa"
"Yelapa, Jalisco, Mexico",-105.4481793,20.4878682,"48422 yelapa, jalisco, mexico"
"Silver Cliff, CO, United States",-105.4463902,38.1352779,"silver cliff, co 81252, usa"
"Douglas, WY, United States",-105.3822069,42.7596897,"douglas, wy 82633, usa"
"Evergreen, CO, United States",-105.3172146,39.6333213,"evergreen, co 80439, usa"
"Boulder, CO, United States",-105.2705456,40.0149856,"boulder, co, usa"
"Yelapa-Puerto Vallarta, , Mexico",-105.2329424,20.6596588,"calle yelapa, puerto vallarta, jal., mexico"
"Golden, CO, United States",-105.2210997,39.755543,"golden, co, usa"
"Hygiene, CO, United States",-105.1781092,40.1893942,"hygiene, co 80503, usa"
"Bellvue, CO, United States",-105.1725918,40.6295895,"bellvue, co 80512, usa"
"Florence, CO, United States",-105.1185988,38.3902777,"florence, co 81226, usa"
"Lafayette, CO, United States",-105.0897058,39.9935959,"lafayette, co, usa"
"Fort Collins, CO, United States",-105.084423,40.5852602,"fort collins, co, usa"
"Lakewood, CO, United States",-105.0813734,39.7047095,"lakewood, co, usa"
"Berthoud, CO, United States",-105.0810924,40.3083174,"berthoud, co, usa"
"Wheatridge, CO, United States",-105.0772063,39.766098,"wheat ridge, co, usa"
"Erie, CO, United States",-105.0499817,40.0502623,"erie, co, usa"
", NM, United States",-105.0323635,34.9727305,"new mexico, usa"
"Littleton, CO, United States",-105.0166498,39.613321,"littleton, co, usa"
"Denver, CO, United States",-104.990251,39.7392358,"denver, co, usa"
"Englewood, CO, United States",-104.9877597,39.6477653,"englewood, co, usa"
"Beulah, CO, United States",-104.986655,38.0750064,"beulah, beulah valley, co 81023, usa"
"Glendale, CO, United States",-104.9335904,39.7049873,"glendale, co 80246, usa"
"Manitou Springs, CO, United States",-104.9128177,38.8575579,"manitou springs, co 80829, usa"
"Centennial, CO, United States",-104.8771726,39.5807452,"centennial, co, usa"
"Monument, CO, United States",-104.872758,39.0916586,"monument, co, usa"
"Colorado Springs, CO, United States",-104.8213634,38.8338816,"colorado springs, co, usa"
"Cheyenne, WY, United States",-104.8202462,41.1399814,"cheyenne, wy, usa"
"Greeley, CO, United States",-104.7091322,40.4233142,"greeley, co, usa"
"Aguilar, CO, United States",-104.6533187,37.402793,"aguilar, co 81020, usa"
"Pueblo, CO, United States",-104.6091409,38.2544472,"pueblo, co, usa"
"Roswell, NM, United States",-104.5230242,33.3942655,"roswell, nm, usa"
"Artesia, NM, United States",-104.4032962,32.8423345,"artesia, nm 88210, usa"
"Spearfish, SD, United States",-103.8593698,44.4908172,"spearfish, sd, usa"
"Scottsbluff, NE, United States",-103.6671662,41.8666341,"scottsbluff, ne 69361, usa"
"Guadalajara, Jalisco, Mexico",-103.3496092,20.6596988,"guadalajara, jalisco, mexico"
"Guadalajara, , Mexico",-103.3496092,20.6596988,"guadalajara, jalisco, mexico"
"Rapid City, SC, United States",-103.2310149,44.0805434,"rapid city, sd, usa"
"Rapid City, SD, United States",-103.2310149,44.0805434,"rapid city, sd, usa"
"Clovis, NM, United States",-103.2052272,34.4047987,"clovis, nm 88101, usa"
"Hobbs, NM, United States",-103.1360403,32.7026116,"hobbs, nm, usa"
"Monahans, TX, United States",-102.8926536,31.5942991,"monahans, tx, usa"
"Dickinson, OR, United States",-102.7896242,46.8791756,"dickinson, nd 58601, usa"
"Dickenson, ND, United States",-102.7896242,46.8791756,"dickinson, nd 58601, usa"
"Dalhart, TX, United States",-102.5132497,36.0594772,"dalhart, tx 79022, usa"
"Odessa, TX, United States",-102.3676431,31.8456816,"odessa, tx, usa"
"Midland, TX, United States",-102.0779146,31.9973456,"midland, tx, usa"
"Canyon, TX, United States",-101.9188024,34.9803342,"canyon, tx 79015, usa"
"Lubbock, TX, United States",-101.8456417,33.5845617,"lubbock, tx, usa"
"Amarillo, TX, United States",-101.8312969,35.2219971,"amarillo, tx, usa"
"Plainview, TX, United States",-101.7068417,34.1847936,"plainview, tx 79072, usa"
"Big Spring, TX, United States",-101.4787355,32.2503979,"big spring, tx 79720, usa"
"Minot, NC, United States",-101.2922906,48.2329668,"minot, nd, usa"
"Minot, ND, United States",-101.2922906,48.2329668,"minot, nd, usa"
"Colby, KS, United States",-101.0523773,39.3958369,"colby, ks 67701, usa"
"Mandan, ND, United States",-100.8895761,46.8266603,"mandan, nd 58554, usa"
"Bismark, NC, United States",-100.7876931,46.8054947,"bismarck, nd, usa"
"Bismarck, ND, United States",-100.7876931,46.8054947,"bismarck, nd, usa"
"Bismark, ND, United States",-100.7876931,46.8054947,"bismarck, nd, usa"
"Bismarck, NC, United States",-100.7876931,46.8054947,"bismarck, nd, usa"
"San Miguel de Allende, , Mexico",-100.745235,20.9144491,"san miguel de allende, guanajuato, mexico"
"San Miguel de Allende, Guanajuato, Mexico",-100.745235,20.9144491,"san miguel de allende, guanajuato, mexico"
"Valentine, NE, United States",-100.5509669,42.8727833,"valentine, ne 69201, usa"
"San Angelo, TX, United States",-100.4370375,31.4637723,"san angelo, tx, usa"
"Sweetwater, TX, United States",-100.4059384,32.4709519,"sweetwater, tx 79556, usa"
"Sweet Water, TX, United States",-100.4059384,32.4709519,"sweetwater, tx 79556, usa"
"Pierre, SD, United States",-100.3537522,44.3667876,"pierre, sd 57501, usa"
"Dodge City, KS, United States",-100.0170787,37.7527982,"dodge city, ks 67801, usa"
", TX, United States",-99.9018131,31.9685988,"texas, usa"
"Ciudad Juarez, TX, United States",-99.9018131,31.9685988,"texas, usa"
"Norton, KS, United States",-99.8915113,39.8338946,"norton, ks 67654, usa"
"Abilene, TX, United States",-99.7331439,32.4487364,"abilene, tx, usa"
"Lower Brule, SD, United States",-99.5800809,44.0748794,"lower brule, sd 57548, usa"
"Laredo, TX, United States",-99.5075519,27.5035613,"laredo, tx, usa"
"Altus, OK, United States",-99.3340442,34.637765,"altus, ok, usa"
"Chamberlain, SD, United States",-99.3306556,43.810828,"chamberlain, sd 57325, usa"
"Mexico City, , Mexico",-99.133208,19.4326077,"mexico city, cdmx, mexico"
"Morelos, , Mexico",-99.1013498,18.6813049,"morelos, mexico"
"Larned, KS, United States",-99.098713,38.1805693,"larned, ks 67550, usa"
"Tepoztlan, , Mexico",-99.0930528,18.9848015,"tepoztlán, morelos, mexico"
"Kearney, NE, United States",-99.0816784,40.6993303,"kearney, ne, usa"
"Comfort, TX, United States",-98.9050337,29.967715,"comfort, tx 78013, usa"
"Great Bend, KS, United States",-98.7648073,38.3644567,"great bend, ks 67530, usa"
"Osborne, KS, United States",-98.6947949,39.4388993,"osborne, ks 67473, usa"
"Luray, KS, United States",-98.6889633,39.1105665,"luray, ks 67649, usa"
"Graham, TX, United States",-98.589502,33.1070597,"graham, tx 76450, usa"
"Downs, KS, United States",-98.5420098,39.4986215,"downs, ks 67437, usa"
"San Antonio, TX, United States",-98.4945922,29.4251905,"san antonio, tx, usa"
"Wichita Falls, TX, United States",-98.4933873,33.9137085,"wichita falls, tx, usa"
"Aberdeen, SD, United States",-98.4864829,45.4646985,"aberdeen, sd 57401, usa"
"Watonga, OK, United States",-98.413128,35.8447654,"watonga, ok 73772, usa"
"Lawton, OK, United States",-98.3959291,34.6035669,"lawton, ok, usa"
"Grandisland, NE, United States",-98.3420118,40.9263957,"grand island, ne, usa"
"Grand Island, NE, United States",-98.3420118,40.9263957,"grand island, ne, usa"
"Universal City, TX, United States",-98.3043547,29.5522617,"universal city, tx, usa"
"Renosa, Mexico, United States",-98.2978951,26.0508406,"reynosa, tamaulipas, mexico"
"McAllen, TX, United States",-98.2300124,26.2034071,"mcallen, tx, usa"
"Lyons, KS, United States",-98.2017268,38.3450104,"lyons, ks 67554, usa"
"Henrietta, TX, United States",-98.1953221,33.8173224,"henrietta, tx 76365, usa"
"Lampasas, TX, United States",-98.1816957,31.063784,"lampasas, tx 76550, usa"
"Wimberly, TX, United States",-98.0986204,29.9974362,"wimberley, tx, usa"
"Dripping Springs, TX, United States",-98.0866781,30.1902067,"dripping springs, tx, usa"
"Donna, TX, United States",-98.05195,26.1703525,"donna, tx 78537, usa"
"Harper, KS, United States",-98.0258945,37.2866863,"harper, ks 67058, usa"
"San Marcos, TX, United States",-97.9413941,29.8832749,"san marcos, tx, usa"
"Chickasha, OK, United States",-97.9364326,35.052565,"chickasha, ok, usa"
"Hutchinson, KS, United States",-97.9297743,38.0608445,"hutchinson, ks, usa"
"Enid, OK, United States",-97.8783911,36.3955891,"enid, ok, usa"
"Glenrose, TX, United States",-97.7554986,32.2346721,"glen rose, tx, usa"
"Glen Rose, TX, United States",-97.7554986,32.2346721,"glen rose, tx, usa"
"Austin, TX, United States",-97.7430608,30.267153,"austin, tx, usa"
"Killeen, TX, United States",-97.7277959,31.1171194,"killeen, tx, usa"
"Temple- Killeen, TX, United States",-97.6982272,31.1241507,"texas, usa"
"Temple-Killeen, TX, United States",-97.6982272,31.1241507,"texas, usa"
"Harlingen, TX, United States",-97.6961026,26.1906306,"harlingen, tx, usa"
"Skidmore, TX, United States",-97.6855522,28.2541716,"skidmore, tx 78389, usa"
"Concordia, KS, United States",-97.6625396,39.5708354,"concordia, ks 66901, usa"
"Salina, KS, United States",-97.6114237,38.8402805,"salina, ks, usa"
"Oklahoma City, OK, United States",-97.5164276,35.4675602,"oklahoma city, ok, usa"
"Brownsville, TX, United States",-97.4974838,25.9017472,"brownsville, tx, usa"
"Red Rock, TX, United States",-97.4461058,29.9596656,"red rock, tx 78662, usa"
"Norman, OK, United States",-97.4394777,35.2225668,"norman, ok, usa"
"Norfolk, NE, United States",-97.4168171,42.0327168,"norfolk, ne 68701, usa"
"Yankton, SD, United States",-97.3972813,42.8711088,"yankton, sd 57078, usa"
"Corpus Christi, TX, United States",-97.396381,27.8005828,"corpus christi, tx, usa"
"Noble, OK, United States",-97.394753,35.1392357,"noble, ok, usa"
"Haysville, KS, United States",-97.3522635,37.5643352,"haysville, ks, usa"
"Utica, NE, United States",-97.3461295,40.8943807,"utica, ne 68456, usa"
"Newton, KS, United States",-97.3450365,38.0466779,"newton, ks, usa"
"Temple, TX, United States",-97.342782,31.0982344,"temple, tx, usa"
"Fort Worth, TX, United States",-97.3307658,32.7554883,"fort worth, tx, usa"
"Ft Worth, TX, United States",-97.3307658,32.7554883,"fort worth, tx, usa"
"Ft. Worth, TX, United States",-97.3307658,32.7554883,"fort worth, tx, usa"
"Wichita, KS, United States",-97.330053,37.6871761,"wichita, ks, usa"
"Bastrop, TX, United States",-97.3152701,30.1104947,"bastrop, tx 78602, usa"
"Walton, KS, United States",-97.2567001,38.1177891,"walton, ks, usa"
"Leonard, ND, United States",-97.2456467,46.6519149,"leonard, nd 58052, usa"
"Port Isabel, TX, United States",-97.2085844,26.0734119,"port isabel, tx, usa"
"Carroll, NE, United States",-97.189217,42.2761129,"carroll, ne 68723, usa"
"South Padre Island, TX, United States",-97.1681257,26.1118401,"south padre island, tx 78597, usa"
"Waco, TX, United States",-97.1466695,31.549333,"waco, tx, usa"
"Thackerville, OK, United States",-97.143068,33.7934373,"thackerville, ok 73459, usa"
"Thackkerville, OK, United States",-97.143068,33.7934373,"thackerville, ok 73459, usa"
"Winnipeg, MB, Canada",-97.1385145,49.8954221,"winnipeg, mb, canada"
"Gainesville, TX, United States",-97.1333453,33.6259414,"gainesville, tx 76240, usa"
"Gainsville, TX, United States",-97.1333453,33.6259414,"gainesville, tx 76240, usa"
"Denton, TX, United States",-97.1330683,33.2148412,"denton, tx, usa"
"Arlington, TX, United States",-97.1080656,32.735687,"arlington, tx, usa"
"Grapevine Lake, TX, United States",-97.0874964,32.9847426,"grapevine lake, texas, usa"
"Stillwater, OK, United States",-97.0583681,36.1156071,"stillwater, ok, usa"
"Grand Forks, ND, United States",-97.0328547,47.9252568,"grand forks, nd, usa"
"Grand Forks, NC, United States",-97.0328547,47.9252568,"grand forks, nd, usa"
"Victoria, TX, United States",-97.0035982,28.8052674,"victoria, tx, usa"
"Winfield, KS, United States",-96.9955918,37.2397486,"winfield, ks, usa"
"Augusta, KS, United States",-96.9767023,37.6866844,"augusta, ks 67010, usa"
"Irving, TX, United States",-96.9488945,32.8140177,"irving, tx, usa"
"Shawnee, OK, United States",-96.9253004,35.3272928,"shawnee, ok, usa"
"Lennox, SD, United States",-96.8919951,43.3541476,"lennox, sd 57039, usa"
"Carrollton, TX, United States",-96.8899636,32.9756415,"carrollton, tx, usa"
"Junction City, KS, United States",-96.8313978,39.0286093,"junction city, ks, usa"
"Brookings, SD, United States",-96.7983877,44.3113573,"brookings, sd 57006, usa"
"Dallas, TX, United States",-96.7969879,32.7766642,"dallas, tx, usa"
"Fargo, ND, United States",-96.7898034,46.8771863,"fargo, nd, usa"
"Fargo, NC, United States",-96.7898034,46.8771863,"fargo, nd, usa"
"Moorhead, MN, United States",-96.7678039,46.8737648,"moorhead, mn, usa"
"Sioux Falls, SD, United States",-96.731265,43.5460223,"sioux falls, sd, usa"
"Richardson, TX, United States",-96.7298519,32.9483335,"richardson, tx, usa"
"Lincoln, NE, United States",-96.7025955,40.813616,"lincoln, ne, usa"
"Caldwell, TX, United States",-96.6930303,30.5313152,"caldwell, tx 77836, usa"
"Calvert, TX, United States",-96.6738627,30.9779651,"calvert, tx 77837, usa"
"Manhattan, KS, United States",-96.5716694,39.1836082,"manhattan, ks, usa"
"Columbus, TX, United States",-96.5396933,29.7066232,"columbus, tx, usa"
"Sioux City, IA, United States",-96.4049408,42.4963416,"sioux city, ia, usa"
"Durant, OK, United States",-96.3971233,33.9924186,"durant, ok, usa"
"Bryan, TX, United States",-96.3699632,30.6743643,"bryan, tx, usa"
"College Station, TX, United States",-96.3344068,30.627977,"college station, tx, usa"
"Alma, KS, United States",-96.2891624,39.0166657,"alma, ks 66401, usa"
"Caddo, OK, United States",-96.2633229,34.1267595,"caddo, ok 74729, usa"
"Emporia, KS, United States",-96.1816626,38.403903,"emporia, ks 66801, usa"
"Hamilton, KS, United States",-96.1641647,37.9794705,"hamilton, ks 66853, usa"
"Admire, KS, United States",-96.1030491,38.6411197,"admire, ks, usa"
"Erhard, MN, United States",-96.0986685,46.485515,"erhard, mn 56534, usa"
"Maple Hill, KS, United States",-96.0282195,39.0845812,"maple hill, ks, usa"
"Tulsa, OK, United States",-95.992775,36.1539816,"tulsa, ok, usa"
"Omaha, NE, United States",-95.9345034,41.2565369,"omaha, ne, usa"
"Belluve, NE, United States",-95.9262498,41.1567003,"bellevue, ne, usa"
"Bellevue, NE, United States",-95.9177224,41.151465,"bellevue, ne, usa"
"Rosedale, MN, United States",-95.8914953,47.2782272,"rosedale township, mn 56557, usa"
"Council Bluffs, IA, United States",-95.8608333,41.2619444,"council bluffs, ia, usa"
"Detroit Lakes, MN, United States",-95.8453253,46.8171808,"detroit lakes, mn 56501, usa"
"Detriot Lakes, MN, United States",-95.8453253,46.8171808,"detroit lakes, mn 56501, usa"
"Vergas, MN, United States",-95.8057577,46.6564802,"vergas, mn 56587, usa"
"Richmond, TX, United States",-95.7607832,29.5821811,"richmond, tx, usa"
"Yates Center, KS, United States",-95.7333175,37.8811472,"yates center, ks 66783, usa"
"Saint Mary's, OH, United States",-95.712891,37.09024,"united states"
"Tumon Bay, GU, United States",-95.712891,37.09024,"united states"
"San Juan, PR, United States",-95.712891,37.09024,"united states"
"Hato Ray, PR, United States",-95.712891,37.09024,"united states"
"Puerto Nuevo, PR, United States",-95.712891,37.09024,"united states"
"NA, NA, United States",-95.712891,37.09024,"united states"
"Asan, GU, United States",-95.712891,37.09024,"united states"
"Miramar, PR, United States",-95.712891,37.09024,"united states"
"Agana, GU, United States",-95.712891,37.09024,"united states"
"N/A, CT, United States",-95.712891,37.09024,"united states"
", , United States",-95.712891,37.09024,"united states"
"Maite, GU, United States",-95.712891,37.09024,"united states"
"Independence, KS, United States",-95.7083131,37.2242358,"independence, ks 67301, usa"
"Wakarusa, KS, United States",-95.6960344,38.8856935,"wakarusa, ks 66546, usa"
"Topeka, KS, United States",-95.6751576,39.0473451,"topeka, ks, usa"
"Claremore, OK, United States",-95.61609,36.3125963,"claremore, ok, usa"
"Tomball, TX, United States",-95.6160549,30.0971621,"tomball, tx, usa"
"Cherokee, IA, United States",-95.5515431,42.7496413,"cherokee, ia 51012, usa"
"Hugo, OK, United States",-95.5096821,34.01066,"hugo, ok 74743, usa"
"Willis, TX, United States",-95.4799418,30.4249276,"willis, tx, usa"
"Conroe, TX, United States",-95.4560512,30.3118769,"conroe, tx, usa"
"Angleton, TX, United States",-95.4318847,29.16941,"angleton, tx 77515, usa"
"Houston, TX, United States",-95.3698028,29.7604267,"houston, tx, usa"
"Colony, KS, United States",-95.3655356,38.0708626,"colony, ks 66015, usa"
"Tyler, TX, United States",-95.3010624,32.3512601,"tyler, tx, usa"
"Humble, TX, United States",-95.2621553,29.9988312,"humble, tx, usa"
"Parsons, KS, United States",-95.2610838,37.3403384,"parsons, ks, usa"
"Lawrence, KS, United States",-95.2352501,38.9716689,"lawrence, ks, usa"
"Mount Vernon, TX, United States",-95.2213321,33.1887271,"mt vernon, tx 75457, usa"
"Pasadena, TX, United States",-95.2091006,29.6910625,"pasadena, tx, usa"
"League City, TX, United States",-95.0949303,29.5074538,"league city, tx, usa"
"Dickinson, TX, United States",-95.0513172,29.4607876,"dickinson, tx 77539, usa"
"Talequah, OK, United States",-94.969956,35.91537,"tahlequah, ok 74464, usa"
"Spicer, MN, United States",-94.9400088,45.2330198,"spicer, mn 56288, usa"
"Livingston, TX, United States",-94.9330202,30.7110216,"livingston, tx 77351, usa"
"Bemidji, MN, United States",-94.8826861,47.471573,"bemidji, mn 56601, usa"
"Carroll, IA, United States",-94.8672793,42.0655986,"carroll, ia 51401, usa"
"St. Joseph, MO, United States",-94.846681,39.7674578,"st joseph, mo, usa"
"Nevis, MN, United States",-94.8394565,46.9652363,"nevis, mn 56467, usa"
"Olathe, KS, United States",-94.8191285,38.8813958,"olathe, ks, usa"
"Galveston, TX, United States",-94.7976958,29.3013479,"galveston, tx, usa"
"Longview, TX, United States",-94.7404891,32.5007037,"longview, tx, usa"
"Pittsburgh, KS, United States",-94.70496,37.410884,"pittsburg, ks 66762, usa"
"Weatherby Lake, MO, United States",-94.6960699,39.2377801,"weatherby lake, mo 64152, usa"
"Overland Park, KS, United States",-94.6707917,38.9822282,"overland park, ks, usa"
"Nacogdoches, TX, United States",-94.656004,31.6039455,"nacogdoches, tx, usa"
"Nacogdochies, TX, United States",-94.656004,31.6039455,"nacogdoches, tx, usa"
"Galena, KS, United States",-94.6396714,37.0758952,"galena, ks 66739, usa"
"Kansas City, KS, United States",-94.6267873,39.1155314,"kansas city, ks, usa"
"Kansas City, MO, United States",-94.5785667,39.0997265,"kansas city, mo, usa"
"Kansas City, Morges, United States",-94.5785667,39.0997265,"kansas city, mo, usa"
"Backus, MN, United States",-94.5163876,46.8202373,"backus, mn 56435, usa"
"Joplin, MO, United States",-94.513281,37.0842271,"joplin, mo, usa"
"Noel, MO, United States",-94.485217,36.5456293,"noel, mo 64854, usa"
"Colmesneil, TX, United States",-94.4226266,30.9093987,"colmesneil, tx 75938, usa"
"Fort Smith, AR, United States",-94.4209646,35.3843722,"fort smith, ar, usa"
"Ft. Smith, AK, United States",-94.4209646,35.3843722,"fort smith, ar, usa"
"Ft. Smith, AR, United States",-94.4209646,35.3843722,"fort smith, ar, usa"
"Independence, MO, United States",-94.4155068,39.0911161,"independence, mo, usa"
"Jefferson, IA, United States",-94.3774232,42.0172457,"jefferson, ia 50129, usa"
"Marshall, TX, United States",-94.3674184,32.5448714,"marshall, tx, usa"
"Van Buren, AR, United States",-94.3565578,35.4589055,"van buren, ar 72956, usa"
"Nevada, MO, United States",-94.3546719,37.8392052,"nevada, mo 64772, usa"
"Bentonville, AR, United States",-94.2102141,36.3723561,"bentonville, ar, usa"
"Brainerd, MN, United States",-94.2020084,46.3526733,"brainerd, mn 56401, usa"
"West Fork, AR, United States",-94.1800289,35.9314614,"west fork, ar 72774, usa"
"Fort Dodge, IA, United States",-94.1680158,42.4974694,"fort dodge, ia 50501, usa"
"St. Cloud, MN, United States",-94.1632404,45.5579451,"st cloud, mn, usa"
"Fayetteville, AR, United States",-94.1605839,36.0626579,"fayetteville, ar, usa"
"Fayetteville, AK, United States",-94.1605839,36.0626579,"fayetteville, ar, usa"
"Fayatteville, AR, United States",-94.1605839,36.0626579,"fayetteville, ar, usa"
"Ft. Dodge, IA, United States",-94.1513764,42.3974963,"iowa, usa"
"Beaumont, TX, United States",-94.1265562,30.080174,"beaumont, tx, usa"
"Rogers, AR, United States",-94.1256953,36.3335129,"rogers, ar, usa"
"Rogers, AK, United States",-94.1256953,36.3335129,"rogers, ar, usa"
"Prairie Creek, AR, United States",-94.0618685,36.3420189,"prairie creek, ar 72756, usa"
"Logan, TX, United States",-94.0538013,32.0784979,"logan, tx 75633, usa"
"Texarkana, TX, United States",-94.0476882,33.425125,"texarkana, tx, usa"
"Texarkana, AR, United States",-94.0361745,33.4304827,"texarkana, ar 71854, usa"
"Texarcana, AR, United States",-94.0361745,33.4304827,"texarkana, ar 71854, usa"
"Texarcana, AK, United States",-94.0361745,33.4304827,"texarkana, ar 71854, usa"
"Elkins, AK, United States",-94.0088348,36.0006514,"elkins, ar, usa"
"Elkins, AR, United States",-94.0088348,36.0006514,"elkins, ar, usa"
"Mankato, MN, United States",-93.9993996,44.1635775,"mankato, mn, usa"
"Remer, MN, United States",-93.9160687,47.0560649,"remer, mn 56672, usa"
"Boone, IA, United States",-93.8802273,42.0597047,"boone, ia 50036, usa"
"Ozark, AK, United States",-93.8272262,35.4869588,"ozark, ar 72949, usa"
"Ozark, AR, United States",-93.8272262,35.4869588,"ozark, ar 72949, usa"
"Lawrence, MO, United States",-93.8248241,37.1500679,"lawrence county, mo, usa"
"Magazine, AR, United States",-93.8071877,35.1498666,"magazine, ar 72943, usa"
