"geocode.value","lon","lat","geoAddress"
"Valdosta, FL, United States",-83.2784851,30.8327022,"valdosta, ga, usa"
"Valdosta, GA, United States",-83.2784851,30.8327022,"valdosta, ga, usa"
"Winterville, GA, United States",-83.2782101,33.9670589,"winterville, ga 30683, usa"
"Oxford, MI, United States",-83.2646624,42.8247524,"oxford, oxford charter township, mi 48371, usa"
"Auburn Hills, MI, United States",-83.2341028,42.6875323,"auburn hills, mi, usa"
"Southfield, MI, United States",-83.2218731,42.4733688,"southfield, mi, usa"
"Birmingham, MI, United States",-83.2113192,42.5467012,"birmingham, mi, usa"
"Hazard, KY, United States",-83.1932284,37.24954,"hazard, ky, usa"
"Oak Park, MI, United States",-83.1827051,42.4594803,"oak park, mi 48237, usa"
"Cullowhee, NC, United States",-83.1765333,35.3137111,"cullowhee, nc, usa"
"Melvindale, MI, United States",-83.175203,42.2825383,"melvindale, mi 48122, usa"
"Owens, OH, United States",-83.1579694,40.520337,"owens, pleasant township, oh 43302, usa"
"Wyanotte, MI, United States",-83.1499239,42.2142064,"wyandotte, mi, usa"
"Wyandotte, MI, United States",-83.1499239,42.2142064,"wyandotte, mi, usa"
"Troy, MI, United States",-83.1497751,42.6064095,"troy, mi, usa"
"Clawson, MI, United States",-83.1463166,42.5333682,"clawson, mi, usa"
"Royal Oak, MI, United States",-83.1446485,42.4894801,"royal oak, mi, usa"
"Ferndale, MI, United States",-83.1346478,42.4605917,"ferndale, mi 48220, usa"
"Rochester, MI, United States",-83.1338214,42.680588,"rochester, mi, usa"
"Marion, OH, United States",-83.1285242,40.5886699,"marion, oh 43302, usa"
"Fremont, OH, United States",-83.1218634,41.3503303,"fremont, oh 43420, usa"
"Lavonia, GA, United States",-83.106818,34.4359361,"lavonia, ga 30553, usa"
"Madison Heights, MI, United States",-83.1052028,42.4858692,"madison heights, mi 48071, usa"
"Highland Park, MI, United States",-83.096868,42.4055925,"highland park, mi 48203, usa"
"Imlay City, MI, United States",-83.0777153,43.0247496,"imlay city, mi 48444, usa"
"Delaware, OH, United States",-83.067965,40.2986724,"delaware, oh 43015, usa"
"Detroit, MI, United States",-83.0457538,42.331427,"detroit, mi, usa"
"Puerto Limon, , Costa Rica",-83.0415078,9.9913106,"limón province, limon, costa rica"
"Sterling Heights, MI, United States",-83.0302033,42.5803122,"sterling heights, mi, usa"
"Warren, MI, United States",-83.0146526,42.5144566,"warren, mi, usa"
"Rogersville, TN, United States",-83.0054423,36.407317,"rogersville, tn 37857, usa"
"Columbus, OH, United States",-82.9987942,39.9611755,"columbus, oh, usa"
"Portsmouth, OH, United States",-82.9976742,38.7317431,"portsmouth, oh 45662, usa"
"Chillicothe, OH, United States",-82.9824019,39.3331197,"chillicothe, oh 45601, usa"
"Westerville, OH, United States",-82.9318807,40.1266689,"westerville, oh, usa"
"Clinton Township, MI, United States",-82.9195514,42.5868882,"clinton twp, mi, usa"
"Columbus, FL, United States",-82.9080849,40.0316058,"2868 stelzer rd #327, columbus, oh 43219, usa"
"Summers, GA, United States",-82.907123,32.1574351,"georgia, usa"
"Mt. Clemens, MI, United States",-82.8779754,42.5972563,"mt clemens, mi, usa"
"Mt Clemens, MI, United States",-82.8779754,42.5972563,"mt clemens, mi, usa"
"Mount Clemens, MI, United States",-82.8779754,42.5972563,"mt clemens, mi, usa"
"Chiefland, FL, United States",-82.8598421,29.4749621,"chiefland, fl 32626, usa"
"Canton, NC, United States",-82.8373558,35.5328838,"canton, nc 28716, usa"
"Greenville, TN, United States",-82.8309861,36.1631574,"greeneville, tn, usa"
"Clearwater, FL, United States",-82.8001026,27.9658533,"clearwater, fl, usa"
"Yale, MI, United States",-82.7982634,43.130026,"yale, mi 48097, usa"
"Medeira Beach, FL, United States",-82.7973247,27.7980814,"madeira beach, fl, usa"
"Madeira Beach, FL, United States",-82.7973247,27.7980814,"madeira beach, fl, usa"
"Seminole, FL, United States",-82.7912134,27.8397466,"seminole, fl, usa"
"Largo, FL, United States",-82.7873244,27.9094665,"largo, fl, usa"
"Dunedin, FL, United States",-82.7717684,28.0197404,"dunedin, fl, usa"
"Prestonburg, KY, United States",-82.7715486,37.6656527,"prestonsburg, ky 41653, usa"
"Treasure Island, FL, United States",-82.7689906,27.7691937,"treasure island, fl, usa"
"Palm Harbor, FL, United States",-82.7637127,28.0780718,"palm harbor, fl, usa"
"Saint Pete Beach, FL, United States",-82.7504542,27.7428134,"st pete beach, fl, usa"
"St. Pete Beach, FL, United States",-82.7504542,27.7428134,"st pete beach, fl, usa"
"St. Petersburg Beach, FL, United States",-82.7504542,27.7428134,"st pete beach, fl, usa"
"Holiday, FL, United States",-82.7395454,28.18779,"holiday, fl, usa"
"South Pasadena, FL, United States",-82.7376009,27.7550276,"south pasadena, fl 33707, usa"
"Pass-a-Grille Beach, FL, United States",-82.7367372,27.6956855,"pass-a-grille beach, st pete beach, fl 33706, usa"
"Crestine, OH, United States",-82.7365677,40.7875572,"crestline, oh, usa"
"Marblehead, OH, United States",-82.7354623,41.5403281,"marblehead, lakeside marblehead, oh 43440, usa"
"Brevard, NC, United States",-82.7342919,35.2334472,"brevard, nc, usa"
"Anna Maria, FL, United States",-82.7334334,27.5311474,"anna maria, fl, usa"
"New Port Richey, FL, United States",-82.7192671,28.2441768,"new port richey, fl, usa"
"Sandusky, OH, United States",-82.7116821,41.4561754,"sandusky, oh 44870, usa"
"Gulfport, FL, United States",-82.7034334,27.7483613,"gulfport, fl, usa"
"Pinellas Park, FL, United States",-82.6995443,27.8428025,"pinellas park, fl, usa"
"Safety Harbor, FL, United States",-82.6931553,27.9908529,"safety harbor, fl, usa"
"Candler, NC, United States",-82.6927363,35.5360973,"candler, nc 28715, usa"
"Harbor Beach, MI, United States",-82.6513186,43.8447369,"harbor beach, mi 48441, usa"
"Saint Petersburg, FL, United States",-82.6402915,27.7676008,"st. petersburg, fl, usa"
"St Petersburg, FL, United States",-82.6402915,27.7676008,"st. petersburg, fl, usa"
"St. Pete, FL, United States",-82.6402915,27.7676008,"st. petersburg, fl, usa"
"St. Petersburg, FL, United States",-82.6402915,27.7676008,"st. petersburg, fl, usa"
"Ashland, KY, United States",-82.6379387,38.4784144,"ashland, ky, usa"
"Alexandria, OH, United States",-82.6123872,40.0889523,"alexandria, oh 43001, usa"
"Lancaster, OH, United States",-82.5993294,39.7136754,"lancaster, oh 43130, usa"
"Bradenton, FL, United States",-82.5748194,27.4989278,"bradenton, fl, usa"
"Kingsport, TN, United States",-82.5618186,36.548434,"kingsport, tn, usa"
"Weaverville, NC, United States",-82.5606851,35.6970547,"weaverville, nc 28787, usa"
"Asheville, NC, United States",-82.5514869,35.5950581,"asheville, nc, usa"
"Ashville, NC, United States",-82.5514869,35.5950581,"asheville, nc, usa"
"Asheville, MS, United States",-82.5514869,35.5950581,"asheville, nc, usa"
"Millersport, OH, United States",-82.534048,39.9000639,"millersport, oh 43046, usa"
"Sarasota , FL, United States",-82.5310117,27.336465,"sarasota, fl, usa"
"Sarasota, FL, United States",-82.5310117,27.336465,"sarasota, fl, usa"
"Saratosa, FL, United States",-82.5310117,27.336465,"sarasota, fl, usa"
"Rockbridge, OH, United States",-82.5222594,39.5798084,"rockbridge, oh 43149, usa"
"Granville, OH, United States",-82.5196037,40.0681192,"granville, oh, usa"
"Archer, FL, United States",-82.5189969,29.5299677,"archer, fl 32618, usa"
"Mansfield, OH, United States",-82.5154471,40.75839,"mansfield, oh, usa"
"Bellville, OH, United States",-82.5107222,40.6200588,"bellville, oh, usa"
"Alachua, FL, United States",-82.4944226,29.7938144,"alachua, fl, usa"
"Belton, SC, United States",-82.4942948,34.5228881,"belton, sc 29627, usa"
"Gray, TN, United States",-82.4765352,36.4198258,"gray, tn 37615, usa"
"Jonesborough, TN, United States",-82.4734787,36.2942722,"jonesborough, tn 37659, usa"
"Zebulon, KY, United States",-82.4665383,37.5334335,"zebulon, ky 41557, usa"
"Creola, OH, United States",-82.4662671,39.3153474,"creola, oh 45622, usa"
"Hendersonville, NC, United States",-82.4609528,35.3187279,"hendersonville, nc, usa"
"Land O' Lakes, FL, United States",-82.4575938,28.2188992,"land o' lakes, fl, usa"
"Tampa, FL, United States",-82.4571776,27.950575,"tampa, fl, usa"
"Venice, FL, United States",-82.4542632,27.0997775,"venice, fl, usa"
"Laurel, FL, United States",-82.453152,27.1303319,"laurel, fl, usa"
"Tampa Springs, FL, United States",-82.4472521,28.0252795,"sulphur springs, tampa, fl 33604, usa"
"Huntington (WV), WV, United States",-82.445154,38.4192496,"huntington, wv, usa"
"Huntington, WV, United States",-82.445154,38.4192496,"huntington, wv, usa"
"Ybor City, FL, United States",-82.4259518,27.9645757,"ybor city, tampa, fl, usa"
"Port Huron, MI, United States",-82.4249142,42.9708634,"port huron, mi, usa"
"Vidalia, GA, United States",-82.4134614,32.2176855,"vidalia, ga, usa"
"Newark, OH, United States",-82.4012642,40.0581205,"newark, oh, usa"
"Greenville, SC, United States",-82.3940104,34.8526176,"greenville, sc, usa"
"Temple Terrace, FL, United States",-82.3892596,28.0352964,"temple terrace, fl, usa"
"Brooksville, FL, United States",-82.3878709,28.5552719,"brooksville, fl 34601, usa"
"Johnson City, TN, United States",-82.3534727,36.3134397,"johnson city, tn, usa"
"Unicoi, TN, United States",-82.3495818,36.1953862,"unicoi, tn, usa"
"Iverness, FL, United States",-82.3313955,28.8354507,"inverness, fl, usa"
"Gainseville, FL, United States",-82.324998,29.6519563,"gainesville, fl, usa"
"Gainesville, FL, United States",-82.3248262,29.6516344,"gainesville, fl, usa"
"Glenford, OH, United States",-82.317094,39.8881223,"glenford, oh 43739, usa"
"Barboursville, WV, United States",-82.2945923,38.4095298,"barboursville, wv, usa"
"Brandon, FL, United States",-82.2859247,27.937801,"brandon, fl, usa"
"Seffner, FL, United States",-82.2756468,27.9836329,"seffner, fl, usa"
"Boca Grande, FL, United States",-82.2616717,26.7490152,"boca grande, fl 33921, usa"
"Hodges, SC, United States",-82.2442889,34.2876186,"hodges, sc 29653, usa"
"Greer, SC, United States",-82.2270568,34.9387279,"greer, sc, usa"
"Oberlin, OH, United States",-82.2173786,41.2939386,"oberlin, oh 44074, usa"
"New Lexington, OH, United States",-82.2084804,39.7139578,"new lexington, oh 43764, usa"
"Columbus, NC, United States",-82.1970584,35.2531698,"columbus, nc 28722, usa"
"Fountain Inn, SC, United States",-82.1956679,34.6890095,"fountain inn, sc, usa"
"Bristol, TN, United States",-82.1887444,36.5951059,"bristol, tn, usa"
"Bristol, VA, United States",-82.1887368,36.595142,"bristol, va, usa"
"Loraine, OH, United States",-82.1823746,41.452819,"lorain, oh, usa"
"Lorain, OH, United States",-82.1823746,41.452819,"lorain, oh, usa"
"Ridge Manor, FL, United States",-82.1814801,28.4991075,"ridge manor, fl, usa"
"Greenwood, SC, United States",-82.1617883,34.1954001,"greenwood, sc, usa"
"Plant City, FL, United States",-82.1128641,28.0186323,"plant city, fl, usa"
"Bushnell, FL, United States",-82.1128629,28.6649924,"bushnell, fl 33513, usa"
"Sanibel Island, FL, United States",-82.1115119,26.4433972,"sanibel island, florida, usa"
"Elyria, OH, United States",-82.1076486,41.3683798,"elyria, oh 44035, usa"
"Athens, OH, United States",-82.1012554,39.3292396,"athens, oh 45701, usa"
"Millfield, OH, United States",-82.0966442,39.4327866,"millfield, oh 45761, usa"
"Port Charlotte, FL, United States",-82.0906448,26.9761707,"port charlotte, fl, usa"
"Inman, SC, United States",-82.0901088,35.0470617,"inman, sc 29349, usa"
"Inman, NC, United States",-82.0901088,35.0470617,"inman, sc 29349, usa"
"Hawthorne, FL, United States",-82.0873181,29.5919136,"hawthorne, fl 32640, usa"
"Pruce Pine, NC, United States",-82.0645611,35.9154007,"spruce pine, nc 28777, usa"
"Spruce Pine, NC, United States",-82.0645611,35.9154007,"spruce pine, nc 28777, usa"
"Melrose, FL, United States",-82.0497944,29.7098064,"melrose, fl 32666, usa"
"Punta Gorda, FL, United States",-82.0453664,26.9297836,"punta gorda, fl, usa"
"Woodruff, SC, United States",-82.0370466,34.7395701,"woodruff, sc 29388, usa"
"Avon Lake, OH, United States",-82.0282001,41.5053178,"avon lake, oh 44012, usa"
"Augusta, GA, United States",-82.0105148,33.4734978,"augusta, ga, usa"
"Abingdon, VA, United States",-81.9773482,36.7098335,"abingdon, va, usa"
"Ft. McCoy, FL, United States",-81.9670322,29.3649734,"fort mccoy, fl 32134, usa"
"N Augusta, SC, United States",-81.9651152,33.5018026,"north augusta, sc, usa"
"North Augusta, SC, United States",-81.9651152,33.5018026,"north augusta, sc, usa"
"Rutherfordton, NC, United States",-81.9567716,35.3692877,"rutherfordton, nc, usa"
"Lakeland, FL, United States",-81.9498042,28.0394654,"lakeland, fl, usa"
"Cape Coral, FL, United States",-81.9495331,26.5628537,"cape coral, fl, usa"
"Fort Myers Beach, FL, United States",-81.948145,26.4520248,"fort myers beach, fl 33931, usa"
"Wooster, OH, United States",-81.935143,40.8050565,"wooster, oh 44691, usa"
"Spartanburg, SC, United States",-81.9320482,34.9495672,"spartanburg, sc, usa"
"Rosedale, VA, United States",-81.9312351,36.9592782,"rosedale, va 24280, usa"
"North Olmstead, OH, United States",-81.9234726,41.4156025,"north olmsted, oh, usa"
"Guysville, OH, United States",-81.9233193,39.2899083,"guysville, oh, usa"
"Chester, OH, United States",-81.9226372,39.0875777,"chester, oh 45720, usa"
"North Fort Myers, FL, United States",-81.8800861,26.6672935,"north fort myers, fl, usa"
"Leesburg, FL, United States",-81.8778582,28.810823,"leesburg, fl, usa"
"Fort Myers, FL, United States",-81.8723084,26.640628,"fort myers, fl, usa"
"Ft. Myers, FL, United States",-81.8723084,26.640628,"fort myers, fl, usa"
"Middleburg, FL, United States",-81.8603778,30.0688512,"middleburg, fl 32068, usa"
"Coshocton, OH, United States",-81.8595756,40.2720151,"coshocton, oh 43812, usa"
"Berea, OH, United States",-81.8543026,41.3661614,"berea, oh 44017, usa"
"Lakewood, OH, United States",-81.7981908,41.4819932,"lakewood, oh, usa"
"Naples, FL, United States",-81.7948103,26.1420358,"naples, fl, usa"
"Key West, FL, United States",-81.7841722,24.5554183,"key west, florida 33040, usa"
"Statesboro, GA, United States",-81.7831674,32.4487876,"statesboro, ga, usa"
"Bonita Springs, FL, United States",-81.7786972,26.339806,"bonita springs, fl, usa"
"Parma Hts., OH, United States",-81.7595769,41.3900518,"parma heights, oh 44130, usa"
"Winter Haven, FL, United States",-81.7328567,28.0222435,"winter haven, fl, usa"
"Wadsworth, OH, United States",-81.7298519,41.0256101,"wadsworth, oh 44281, usa"
"Lake Alfred, FL, United States",-81.7234114,28.091963,"lake alfred, fl, usa"
"Aiken, SC, United States",-81.7195533,33.5604168,"aiken, sc, usa"
"Cleveland, OH, United States",-81.6943605,41.49932,"cleveland, oh, usa"
"Morganton, NC, United States",-81.6848188,35.7454071,"morganton, nc 28655, usa"
"Boone, NC, United States",-81.6745517,36.216795,"boone, nc, usa"
"Jacksonville, FL, United States",-81.655651,30.3321838,"jacksonville, fl, usa"
"Gaffney, SC, United States",-81.6498195,35.0717945,"gaffney, sc, usa"
"Richfield, OH, United States",-81.6381785,41.2397772,"richfield, oh, usa"
"Charleston, WV, United States",-81.6326234,38.3498195,"charleston, wv, usa"
"Crest, MS, United States",-81.6187496,35.277097,"315 beaver dam church rd, shelby, nc 28152, usa"
"Barberton, OH, United States",-81.6051221,41.012833,"barberton, oh 44203, usa"
"Davenport, FL, United States",-81.6017417,28.1614046,"davenport, fl, usa"
"Todd, NC, United States",-81.5956937,36.3093112,"todd, nc 28684, usa"
"Sorrento, FL, United States",-81.5636838,28.80777,"sorrento, fl 32776, usa"
"Parksburg, WV, United States",-81.5615135,39.2667418,"parkersburg, wv, usa"
"Parkersburg, WV, United States",-81.5615135,39.2667418,"parkersburg, wv, usa"
"Parkerburg, WV, United States",-81.5615135,39.2667418,"parkersburg, wv, usa"
"Cleveland Heights, OH, United States",-81.556235,41.5200518,"cleveland heights, oh, usa"
"Shaker Heights, OH, United States",-81.5370671,41.4739419,"shaker heights, oh, usa"
"Shelby, NC, United States",-81.5356463,35.2923513,"shelby, nc, usa"
"Apopka, FL, United States",-81.5322149,28.6934076,"apopka, fl, usa"
"Lakeshore, OH, United States",-81.5267873,41.5931049,"euclid, oh, usa"
"Strasburg, OH, United States",-81.5267864,40.5947844,"strasburg, oh 44680, usa"
"Lake Buena Vista, FL, United States",-81.5261474,28.3695351,"lake buena vista, fl 32830, usa"
"Akron, OH, United States",-81.5190053,41.0814447,"akron, oh, usa"
"Blacksburg, SC, United States",-81.5159246,35.1212408,"blacksburg, sc 29702, usa"
", FL, United States",-81.5157535,27.6648274,"florida, usa"
"Athens, FL, United States",-81.5157535,27.6648274,"florida, usa"
"Augusta, FL, United States",-81.5157535,27.6648274,"florida, usa"
"Albany, FL, United States",-81.5157535,27.6648274,"florida, usa"
"St. Simon's Isle, FL, United States",-81.5157535,27.6648274,"florida, usa"
"Beachwood, OH, United States",-81.5087322,41.4644979,"beachwood, oh 44122, usa"
"Brunswick, GA, United States",-81.4914894,31.1499528,"brunswick, ga, usa"
"Elkview, WV, United States",-81.4773294,38.4318841,"elkview, wv 25071, usa"
"Fernandina Beach, FL, United States",-81.4625919,30.6696818,"fernandina beach, fl 32034, usa"
"Amelia Island, FL, United States",-81.460856,30.6265697,"amelia island, florida 32034, usa"
"Kissimmee, FL, United States",-81.407571,28.2919557,"kissimmee, fl, usa"
"Willoughby, OH, United States",-81.4065011,41.6397696,"willoughby, oh 44094, usa"
"Neptune Beach, FL, United States",-81.3964734,30.311908,"neptune beach, fl, usa"
"Jacksonville Beach, FL, United States",-81.3961338,30.2841224,"jacksonville beach, fl, usa"
"College Park, FL, United States",-81.389435,28.5711401,"college park, orlando, fl 32804, usa"
"St. Simons Island, GA, United States",-81.3885517,31.1595905,"st simons island, ga 31522, usa"
"Orlando, FL, United States",-81.3789269,28.5383832,"orlando, fl, usa"
"Canton, OH, United States",-81.378447,40.7989473,"canton, oh, usa"
"Kent, OH, United States",-81.3578859,41.1536674,"kent, oh, usa"
"Chapin, SC, United States",-81.3498211,34.1659795,"chapin, sc 29036, usa"
"Hickory, NC, United States",-81.3444573,35.7344538,"hickory, nc, usa"
"Mentor, OH, United States",-81.339552,41.6661573,"mentor, oh 44060, usa"
"Winter Park, FL, United States",-81.3392352,28.5999998,"winter park, fl, usa"
"St Augustine's, FL, United States",-81.3139313,29.8921835,"st. augustine, fl, usa"
"Augustine, FL, United States",-81.3124341,29.9012437,"st. augustine, fl, usa"
"Saint Augustine, FL, United States",-81.3124341,29.9012437,"st. augustine, fl, usa"
"St Augustine, FL, United States",-81.3124341,29.9012437,"st. augustine, fl, usa"
"St. Augustine, FL, United States",-81.3124341,29.9012437,"st. augustine, fl, usa"
"Deland, FL, United States",-81.3031179,29.028318,"deland, fl, usa"
"Lions Head, ON, Canada",-81.2546076,44.9871484,"lion's head, on n0h 1w0, canada"
"Painesville, OH, United States",-81.245657,41.7244885,"painesville, oh 44077, usa"
"Painsville, OH, United States",-81.245657,41.7244885,"painesville, oh 44077, usa"
"London, ON, Canada",-81.2452768,42.9849233,"london, on, canada"
"London, Ontario, Canada",-81.2452768,42.9849233,"london, on, canada"
"Bluefield, WV, United States",-81.2223195,37.2698395,"bluefield, wv 24701, usa"
"Conover, NC, United States",-81.2186933,35.7065217,"conover, nc, usa"
"Beckley, WV, United States",-81.1881557,37.7781702,"beckley, wv 25801, usa"
"Gastonia, NC, United States",-81.1870849,35.2621735,"gastonia, nc, usa"
"Fayetteville, WV, United States",-81.1039911,38.0528884,"fayetteville, wv 25840, usa"
"Garrettsville, OH, United States",-81.0964856,41.2842224,"garrettsville, oh 44231, usa"
"Savannah, GA, United States",-81.091203,32.0808989,"savannah, ga, usa"
"Savannah, FL, United States",-81.091203,32.0808989,"savannah, ga, usa"
"Grandview Pike, WV, United States",-81.0687154,37.8251133,"grandview, wv 25813, usa"
"Ormond Beach, FL, United States",-81.0558894,29.2858129,"ormond beach, fl, usa"
"Holly Hill, FL, United States",-81.0375555,29.2435916,"holly hill, fl, usa"
"Columbia, SC, United States",-81.0348144,34.0007104,"columbia, sc, usa"
"Daytona, FL, United States",-81.0228331,29.2108147,"daytona beach, fl, usa"
"Daytona Beach, FL, United States",-81.0228331,29.2108147,"daytona beach, fl, usa"
"Sudbury, ON, Canada",-80.993029,46.4917317,"greater sudbury, on, canada"
"Aylmer, Ontario, Canada",-80.9828842,42.7729381,"aylmer, on n5h, canada"
"Daytona Beach Shores, FL, United States",-80.9828323,29.1760933,"daytona beach shores, fl 32118, usa"
"Jumping Branch, WV, United States",-80.9764795,37.6576185,"jumping branch, wv 25951, usa"
"Nimitz, WV, United States",-80.9600897,37.6462298,"nimitz, wv 25951, usa"
"Geneva on the Lake, OH, United States",-80.9539831,41.8594971,"geneva-on-the-lake, oh 44041, usa"
"Galax, VA, United States",-80.9239671,36.6612387,"galax, va 24333, usa"
"Smyrna Beach, FL, United States",-80.9108271,29.0654833,"smyrna beach, smyrna dunes park, new smyrna beach, fl 32169, usa"
"St. Claire, OH, United States",-80.90176,40.0803199,"st clairsville, oh 43950, usa"
"Statesville, NC, United States",-80.8883291,35.7846006,"statesville, nc, usa"
"Martinsville, WV, United States",-80.8575993,39.6445214,"new martinsville, wv 26155, usa"
"Summers County, WV, United States",-80.8543847,37.5812062,"summers county, wv, usa"
"Summersville, WV, United States",-80.8525981,38.2812203,"summersville, wv 26651, usa"
"Savannah Beach, GA, United States",-80.845666,32.0002152,"tybee island, ga 31328, usa"
"Charlotte, NC, United States",-80.8431267,35.2270869,"charlotte, nc, usa"
"Warren, OH, United States",-80.8184166,41.2375569,"warren, oh, usa"
"Titusville, FL, United States",-80.8075537,28.6122187,"titusville, fl, usa"
"Niles, OH, United States",-80.765358,41.1828353,"niles, oh, usa"
"Hilton Head, SC, United States",-80.752608,32.216316,"hilton head island, sc, usa"
"Hilton Head, GA, United States",-80.752608,32.216316,"hilton head island, sc, usa"
"Woodstock, ON, Canada",-80.7471651,43.1314966,"woodstock, on, canada"
"Coca, FL, United States",-80.7419984,28.3861159,"cocoa, fl, usa"
"Wheeling, WV, United States",-80.7209149,40.0639616,"wheeling, wv 26003, usa"
"Columbiana, OH, United States",-80.6939643,40.8883931,"columbiana, oh 44408, usa"
"Beaufort, SC, United States",-80.6698286,32.4315813,"beaufort, sc, usa"
"Indian Trail, NC, United States",-80.6692352,35.0768141,"indian trail, nc, usa"
"Walterboro, SC, United States",-80.6667688,32.9051704,"walterboro, sc 29488, usa"
"Merritt Island, FL, United States",-80.6659842,28.3180688,"merritt island, fl, usa"
"North Lima, OH, United States",-80.6584754,40.9483249,"north lima, oh 44452, usa"
"Youngstown, OH, United States",-80.6495194,41.0997803,"youngstown, oh, usa"
"Steubenville, OH, United States",-80.6339638,40.3697905,"steubenville, oh, usa"
"Dade County, FL, United States",-80.6326916,25.5516034,"miami-dade county, fl, usa"
"Kannapolis, NC, United States",-80.6217341,35.4873613,"kannapolis, nc, usa"
"Melbourne, FL, United States",-80.6081089,28.0836269,"melbourne, fl, usa"
"Cape Canaveral, FL, United States",-80.6077132,28.3922182,"cape canaveral, fl 32920, usa"
"Cocoa Beach, FL, United States",-80.6075513,28.3200067,"cocoa beach, fl 32931, usa"
"Concord, NC, United States",-80.579511,35.4087517,"concord, nc, usa"
"Mocksville, NC, United States",-80.5614494,35.8940263,"mocksville, nc 27028, usa"
"Indian Valley, VA, United States",-80.5520059,36.9087407,"indian valley, va 24105, usa"
"Waterloo, ON, Canada",-80.5204096,43.4642578,"waterloo, on, canada"
"Sharon, PA, United States",-80.4934035,41.2331116,"sharon, pa, usa"
"Homestead, FL, United States",-80.4775569,25.4687224,"homestead, fl, usa"
"Salisbury, NC, United States",-80.4742261,35.6709727,"salisbury, nc, usa"
"Sebastian, FL, United States",-80.4706078,27.816415,"sebastian, fl, usa"
"Lewisburg, WV, United States",-80.4456303,37.8017879,"lewisburg, wv 24901, usa"
"Blacksburg, VA, United States",-80.4139393,37.2295733,"blacksburg, va, usa"
"Holly Hill, SC, United States",-80.4137037,33.3226624,"holly hill, sc 29059, usa"
"Vero Beach, FL, United States",-80.3972736,27.6386434,"vero beach, fl, usa"
"Horner, WV, United States",-80.3825877,39.0006516,"horner, wv 26372, usa"
"Goulds, FL, United States",-80.3817793,25.5662141,"goulds, fl, usa"
"Oakland, PA, United States",-80.3695096,40.989783,"oakland, pa 16101, usa"
"Albion, PA, United States",-80.3664542,41.8906112,"albion, pa 16401, usa"
"Broward County, FL, United States",-80.365865,26.190096,"broward county, fl, usa"
"Port Saint Lucie, FL, United States",-80.3582261,27.2730492,"port st. lucie, fl, usa"
"New Castle, PA, United States",-80.347009,41.0036719,"new castle, pa, usa"
"Kanawha Head, WV, United States",-80.3464719,38.77288,"kanawha head, wv 26228, usa"
"Clarksburg, VA, United States",-80.3445341,39.2806451,"clarksburg, wv, usa"
"Clarksburg (WV), WV, United States",-80.3445341,39.2806451,"clarksburg, wv, usa"
"Clarksburg, WV, United States",-80.3445341,39.2806451,"clarksburg, wv, usa"
"Rock Cave, WV, United States",-80.3425838,38.8367674,"rock cave, wv 26234, usa"
"Ft. Pierce, FL, United States",-80.3256056,27.4467056,"fort pierce, fl, usa"
"Floyd, VA, United States",-80.3200502,36.9112443,"floyd, va 24091, usa"
"Conneaut Lake, PA, United States",-80.3053416,41.6033874,"conneaut lake, pa 16316, usa"
"French Creek, WV, United States",-80.2973054,38.8856557,"french creek, wv 26201, usa"
"Pembroke Pines, FL, United States",-80.2962555,26.007765,"pembroke pines, fl, usa"
"Rural Hall, NC, United States",-80.2933838,36.2404158,"rural hall, nc, usa"
"Ellwood City, PA, United States",-80.2864515,40.8617303,"ellwood city, pa 16117, usa"
"Rochester, PA, United States",-80.2864509,40.7022882,"rochester, pa, usa"
"Hialeah, FL, United States",-80.2781057,25.8575963,"hialeah, fl, usa"
"Coral Gables, FL, United States",-80.2635411,25.7491968,"coral gables, fl, usa"
"Sunrise, FL, United States",-80.256595,26.1669711,"sunrise, fl, usa"
"Lexington, NC, United States",-80.2533838,35.8240265,"lexington, nc, usa"
"Stuart, FL, United States",-80.2528257,27.197548,"stuart, fl, usa"
